title,slug,category,body,date,labels
Sample Post,Sample-Post,General,"Lorem ipsum dolor sit amet, consectetur adipiscing elit. Duis venenatis sit amet orci ac posuere. Nunc sed orci enim. Nullam at nulla non mauris malesuada tempus efficitur ut metus. Nulla facilisi. Nullam condimentum, ipsum et pretium malesuada, velit nulla aliquet nunc, at sollicitudin libero erat quis nulla. Mauris euismod finibus nisl nec fermentum. Class aptent taciti sociosqu ad litora torquent per conubia nostra, per inceptos himenaeos. Quisque eleifend vulputate arcu nec maximus. Etiam quis risus ut purus pretium tincidunt. Mauris mollis neque ut sem euismod, sit amet placerat quam luctus.

Phasellus vehicula tortor sed purus commodo, sit amet pharetra mauris pellentesque. Sed et urna pharetra, sodales felis at, convallis tellus. Nullam sit amet hendrerit metus. Etiam fermentum diam placerat tortor pretium cursus. Aliquam sollicitudin ultricies libero, et semper velit tincidunt ac. Curabitur vitae arcu vel enim ullamcorper auctor facilisis sed tellus. Pellentesque id dignissim augue. Maecenas ac lobortis metus. Proin elit orci, vulputate vel facilisis vel, hendrerit mattis arcu. Phasellus ut euismod tellus. Quisque eu ligula consequat, euismod mauris ut, pretium diam. Cras aliquam massa justo, quis posuere dui pulvinar nec.

Sed vitae consectetur felis. Nam lacus tellus, varius id nunc sit amet, cursus mollis elit. Pellentesque habitant morbi tristique senectus et netus et malesuada fames ac turpis egestas. Phasellus rhoncus bibendum nisi, at faucibus tellus accumsan sollicitudin. Vivamus sit amet commodo tellus. In ullamcorper faucibus consectetur. Praesent dictum lobortis ex, nec tincidunt diam imperdiet id. Sed sit amet mauris dui. Cras porttitor, nibh eget scelerisque posuere, massa justo sollicitudin eros, eget lobortis purus nunc non enim. Aliquam feugiat at felis in vestibulum. Nullam scelerisque lorem eu tellus tristique, a fermentum mauris mollis. Quisque non urna molestie, eleifend diam vitae, fermentum enim. Sed sem eros, ullamcorper in viverra eget, finibus et justo.

Morbi suscipit pellentesque dolor. Donec diam orci, commodo ut elit nec, auctor tempor dolor. Donec ut auctor dolor. Duis mi metus, feugiat at massa at, vehicula semper metus. Etiam interdum hendrerit tortor non tincidunt. Maecenas mattis mi sed gravida dignissim. Integer non tortor sit amet elit tempor commodo. Fusce id justo in mi pellentesque facilisis.

Aenean laoreet semper velit, vitae hendrerit purus faucibus ac. Morbi ut mauris a felis tristique placerat. Praesent ac rhoncus justo, in elementum mauris. Duis in sem neque. Vestibulum ante ipsum primis in faucibus orci luctus et ultrices posuere cubilia curae; Fusce eu ex et leo consectetur bibendum. Nullam ut mi ornare, mattis ligula sit amet, finibus nulla. Fusce suscipit luctus cursus. Pellentesque in dignissim tellus. Nam a ante purus. Aliquam at nibh sit amet augue egestas commodo. Praesent ultrices euismod eros. Nulla facilisi. Curabitur bibendum nunc a nisl condimentum dictum. Mauris scelerisque ipsum dui, et fringilla tellus feugiat sed. Sed tincidunt ornare felis, pellentesque mollis quam venenatis sit amet. ",6/6/2022,"general, common, usual"
Another Sample Post,Another-Sample-Post,Technology,"

Maecenas pretium, nisi sed vulputate eleifend, nisl elit iaculis mauris, gravida gravida turpis nunc quis ligula. Nulla at ex libero. Quisque tincidunt ante lorem, in efficitur ante blandit in. Etiam sed libero velit. Mauris non rhoncus nunc, eu porta purus. Ut pretium convallis magna ut ullamcorper. Donec ultricies ex metus, volutpat ornare sapien euismod quis.

Praesent gravida sem lobortis tristique elementum. Quisque quis velit ac mauris euismod malesuada. Integer id turpis ac metus ullamcorper vestibulum euismod tempor urna. Cras ac aliquam lacus, eu auctor leo. Nulla facilisis, ligula non pretium consequat, lorem quam cursus massa, sit amet vehicula dolor mi eget dolor. Suspendisse congue tempus pretium. Aliquam pellentesque tincidunt justo sed pulvinar. Maecenas faucibus condimentum risus, id malesuada ipsum facilisis vel. Nullam lacus nisl, dignissim rhoncus bibendum quis, faucibus non dolor.

Phasellus sit amet imperdiet augue. Ut et enim fermentum ipsum ultricies lacinia. Donec risus sapien, volutpat auctor leo sed, scelerisque porttitor libero. In in nisl malesuada, lacinia massa quis, consectetur libero. Etiam in massa mauris. Duis elementum ante vitae mi porta, at mollis quam ornare. Maecenas justo mi, maximus eget est et, ornare luctus mi. Nulla aliquam, lectus ac sagittis aliquam, massa turpis ultricies sapien, quis rutrum magna nisi id ligula. Ut congue ullamcorper risus ut laoreet. Nulla auctor fermentum ipsum, id suscipit ex elementum a. Suspendisse aliquet metus semper, elementum est et, lobortis arcu. Integer iaculis semper tellus vel dapibus. Sed quam eros, fermentum malesuada blandit ultrices, efficitur ac nibh.

Nulla ultrices dui turpis, auctor maximus nunc malesuada nec. Donec malesuada non dolor id scelerisque. Aenean sed interdum risus, quis molestie ante. Duis tincidunt convallis ante ac ullamcorper. Nulla imperdiet orci dolor, in fermentum tortor fringilla in. Sed at faucibus metus. Donec lobortis dui nec diam tristique, sed interdum diam consequat. Etiam rhoncus leo condimentum massa gravida, a blandit lorem condimentum. Sed eleifend ultrices justo et tincidunt. In semper ut lectus eu congue. Donec malesuada egestas sagittis. Pellentesque dolor felis, cursus dapibus velit quis, tincidunt semper massa. Nunc eros turpis, condimentum sed lacus ac, commodo iaculis lacus. Sed vitae ipsum sem. Proin vulputate arcu vulputate, viverra felis in, lobortis enim. Aenean malesuada lacus ut metus feugiat sollicitudin.

Vivamus aliquam ligula quis felis finibus placerat. Pellentesque faucibus, nunc in consectetur viverra, enim ante viverra nibh, ut porttitor metus erat ut lacus. Curabitur pretium eros sit amet magna efficitur, non pretium elit lobortis. Praesent varius ut ante quis bibendum. Aenean sollicitudin nulla ac faucibus facilisis. Etiam tristique id erat in cursus. Maecenas volutpat auctor ligula viverra faucibus.

Mauris posuere facilisis eros, tincidunt aliquam eros sodales quis. Nullam nisl dui, tempor in dictum eu, ornare id arcu. In cursus mauris quis finibus fringilla. Quisque sit amet aliquet massa. Nunc placerat purus sit amet accumsan imperdiet. Duis semper pharetra laoreet. Ut vel suscipit justo, at sodales tortor. Vestibulum sollicitudin nunc purus, id hendrerit arcu consectetur ac. Integer sodales pellentesque ipsum, at venenatis augue dapibus ornare. Ut neque quam, bibendum vitae lacus a, semper sagittis ante. Integer ligula tellus, condimentum a neque condimentum, consequat feugiat dolor. Mauris id convallis tellus, quis posuere mauris. Aliquam erat volutpat. Aliquam congue est sed pharetra ultrices. Etiam sagittis lacus id venenatis elementum. ",6/4/2022,"tech, product, general"
Yet Another Sample Post,Yet-Another-Sample-Post,Medical,"

Lorem ipsum dolor sit amet, consectetur adipiscing elit. In tempus dolor in diam sagittis tristique. Duis cursus sollicitudin congue. Vestibulum a orci non diam dapibus consectetur eu at risus. Curabitur felis risus, commodo sed fermentum id, ultricies egestas purus. Nulla mollis nunc in orci gravida, aliquam ultrices risus suscipit. Quisque convallis quis metus eget sollicitudin. Duis finibus, velit ac ultrices dapibus, lorem diam posuere justo, et pulvinar leo velit in sem. Etiam quis vehicula lacus, vitae fermentum libero. Fusce aliquet pharetra diam, id tristique augue lobortis sed. Proin bibendum scelerisque tortor, id dapibus elit pellentesque at. Fusce volutpat erat a turpis mattis accumsan.

Nullam interdum mattis lectus, a fermentum nunc malesuada at. Fusce vehicula lacinia varius. Donec dignissim eros nec elit fringilla porta. Cras sodales sollicitudin tincidunt. Vestibulum viverra blandit felis sit amet laoreet. Etiam odio magna, malesuada eget imperdiet gravida, porta vitae nulla. Curabitur eget ligula quis mi finibus tincidunt sit amet sit amet dolor.

Duis dignissim ullamcorper nisi. Maecenas sit amet est id erat consequat porttitor ac non ante. Pellentesque dapibus eget felis quis blandit. Proin ac lacus et elit aliquet hendrerit. Mauris fermentum ipsum eu efficitur volutpat. Nam et porttitor quam. Mauris ut tincidunt risus, et mattis purus. Class aptent taciti sociosqu ad litora torquent per conubia nostra, per inceptos himenaeos. Vestibulum eget tortor sollicitudin, sollicitudin diam eget, fermentum odio.

Maecenas malesuada nisi quis lacus dignissim, scelerisque dictum neque condimentum. Pellentesque in tellus sit amet purus ultrices hendrerit sed sed turpis. Duis dictum, felis eu porta vestibulum, elit libero finibus nulla, iaculis dapibus lacus massa sit amet enim. Fusce suscipit aliquam metus, eget vestibulum massa facilisis vel. Nunc ut ipsum luctus, condimentum orci ac, efficitur lacus. Morbi venenatis, ipsum lacinia malesuada tincidunt, lectus massa lobortis enim, ullamcorper aliquet diam purus auctor diam. Aenean vulputate est non enim facilisis, at efficitur eros fermentum. Ut quis feugiat est. Nam ac erat vitae risus luctus dignissim. ",5/5/2022,"general, common, medical"
